Stop Code,Stop Name,Latitude,Longitude,Status,Shelter Quantity,Area_Light,Trash Can,Site_Shade,Real Time Sign,Sidewalk Condition,ADA condition,Landing Pad,Crosswalk,Area Light Score,Site Shade Score,Sidewalk Condition Score,Landing Pad Score,Crosswalk Score,ADA Score
5837,Roxboro Rd at Infinity Rd,36.07848,-78.91027,Active,0.0,Good,,,No,,,,,3.0,,,,,
5841,Fayetteville St at Cornwallis Rd (SB),35.960367,-78.910426,Active,0.0,Fair,,,No,Good,No_SidewalkWithStrip,,Fair,2.0,,2.0,,1.0,
5843,Concord St at Otis St,35.975553,-78.902811,Active,,,,,,,,,,,,,,,
5845,Hillandale Rd at Carver St (Durham Public Schools),36.035777,-78.935801,Active,0.0,Good,,,No,Good,No_SidewalkWithStrip,,Fair,3.0,,2.0,,1.0,
5846,Chapel Hill Rd at Vineyard St,35.97798,-78.93575,Active,,,,,,,,,,,,,,,
5848,Flowers Dr at Duke Gardens (SB),36.001158,-78.936439,Active,0.0,Fair,Metal,Trees_Fair,No,,,,Good,2.0,1.0,,,2.0,
5849,Dearborn Dr at Ruth St,36.03712,-78.871228,Active,,,,,,,,,,,,,,,
5850,Glenbrook Dr at Dubonnet Pl (SB),36.026087,-78.876979,Active,0.0,Poor,,,No,Good,No_SidewalkWithStrip,,,1.0,,2.0,,,
5851,Lawson St at Ridgeway Ave,35.973947,-78.887482,Active,1.0,Good,Metal,,No,Poor,Yes_Single_Door,Yes_Single_Door,Excellent,3.0,,0.0,1.0,3.0,2.0
5854,Fayetteville Rd at Dunhill Dr (Triangle Family Practice),35.916311,-78.931996,Active,0.0,Fair,,Trees_Fair,No,Good,No_SidewalkWithStrip,,,2.0,1.0,2.0,,,
5857,Riddle Rd at Triangle Day Care (NB),35.951285,-78.899749,Active,0.0,Good,Concrete,,No,,,,Good,3.0,,,,2.0,
5858,Chapel Hill Rd at Wa Wa Ave,35.979646,-78.934904,Active,0.0,Poor,,Trees_Good,No,,,,,1.0,2.0,,,,
5859,Martin Luther King Jr Pkwy at Lake Cook Dr (WB),35.942065,-78.916912,Active,1.0,,Concrete,Trees_Good,No,Fair,No_SidewalkWithStrip,,,,2.0,1.0,,,
5860,Roxboro Rd at Channing Ave (SB),36.0318,-78.89087,Active,,,,,,,,,,,,,,,
5862,Cornwallis Rd at Bainbridge Dr (NB),35.93994,-78.896922,Active,0.0,Poor,Concrete,,No,,,,,1.0,,,,,
5864,University Dr at Hill St,35.985515,-78.910318,Active,1.0,Fair,Metal,Trees_Fair,No,Poor,No_SidewalkWithStrip,Yes_Single_Door,Excellent,2.0,1.0,0.0,1.0,3.0,
5865,Chapel Hill Rd at McGehee St (SB),35.980865,-78.934583,Active,0.0,Poor,,Trees_Good,No,Fair,No_SidewalkWithStrip,,,1.0,2.0,1.0,,,
5866,Hinson Dr at Glenbrook Dr (NB),36.028598,-78.878889,Active,0.0,,,,No,,,,,,,,,,
5867,Fayetteville St at Elmira Ave (SB),35.965976,-78.905386,Active,0.0,Fair,,Trees_Fair,No,Poor,No_SidewalkWithStrip,,Fair,2.0,1.0,0.0,,1.0,
5868,Club Blvd at Cascadilla St,36.020002,-78.886482,Active,,,,,,,,,,,,,,,
5869,Broad St at F St (NC School of Science and Math),36.018429,-78.919169,Active,1.0,Good,Concrete,,No,Fair,No_SingleDoor,Yes_Single_Door,Fair,3.0,,1.0,1.0,1.0,
5870,Holloway St at Herbert St (EB),35.9916,-78.86485,Active,,,,,,,,,,,,,,,
5876,Ross Rd at Melbourne St,35.99243,-78.84488,Active,0.0,Fair,,Trees_Fair,No,,,,,2.0,1.0,,,,
5877,S Roxboro St at Umstead St (SB),35.9828232,-78.9032209,Active,0.0,Poor,Concrete,,No,Fair,No_SidewalkAbuts,Other,Fair,1.0,,1.0,0.0,1.0,
5880,Club Blvd at Glenbrook Dr,36.023854,-78.876399,Active,0.0,Poor,,Trees_Good,No,,,,,1.0,2.0,,,,
5881,NC 54 at Southpoint Crossing Dr (Homestead Market),35.9109237,-78.938576,Active,,,,,,,,,,,,,,,
5883,Mangum St at W Seminary Ave,35.998938,-78.897425,Active,0.0,,,,,,,,,,,,,,
5884,Chapel Hill St at Brewster St,35.996732,-78.919163,Active,0.0,Fair,,Trees_Good,No,Fair,No_SidewalkWithStrip,,Fair,2.0,2.0,1.0,,1.0,
5892,Sima Ave at Building 18,35.977291,-78.887383,Active,0.0,Poor,,Trees_Good,No,,,,,1.0,2.0,,,,
5896,Roxboro Rd at Old Oxford Rd (SB),36.0351,-78.89282,Active,0.0,Fair,Concrete,,No,Good,Yes_Single_Door,Yes_Single_Door,Good,2.0,,2.0,1.0,2.0,2.0
5897,Club Blvd at Dollar Ave (Northgate Mall),36.016827,-78.910102,Active,1.0,Poor,Concrete,Trees_Good,Yes,Fair,No_SidewalkAbuts,Other,Fair,1.0,2.0,1.0,0.0,1.0,
5898,Holloway St at Driver St (WB),35.994476,-78.878297,Active,0.0,Fair,Concrete,,No,Fair,No_SidewalkWithStrip,,Fair,2.0,,1.0,,1.0,
5899,Briggs Ave at Person St (NB),35.9697269,-78.8769009,Active,1.0,Fair,Concrete,Trees_Fair,No,Good,Yes_Single_Door,Yes_Single_Door,,2.0,1.0,2.0,1.0,,2.0
5900,Chapel Hill St at Kent St (EB),35.996671,-78.916957,Active,1.0,Good,Metal,Trees_Good,No,Good,Yes_Sidewalk,Other,Good,3.0,2.0,2.0,0.0,2.0,3.0
5904,Chapel Hill Rd at Anderson St,35.981954,-78.933386,Active,0.0,Poor,,,No,Poor,No_SidewalkAbuts,Other,Good,1.0,,0.0,0.0,2.0,
5906,Garrett Rd at Eno River Church,35.952282,-78.971116,Active,0.0,Poor,,,No,,,,,1.0,,,,,
5907,Fayetteville St at Piedmont Ave (NB),35.984055,-78.898915,Active,0.0,Fair,Concrete,,No,Good,No_SidewalkWithStrip,,Fair,2.0,,2.0,,1.0,
5908,Chapel Hill Rd at House St,35.9902773,-78.9239567,Active,0.0,Poor,Concrete,,No,Good,No_SidewalkWithStrip,,,1.0,,2.0,,,
5909,Chapel Hill Rd at Colonial Apts (SB),35.970417,-78.938818,Active,0.0,Good,,Trees_Good,No,Good,Yes_Single_Door,Yes_Single_Door,Excellent,3.0,2.0,2.0,1.0,3.0,2.0
5910,Angier Ave at Ellis Rd,35.97297,-78.8668,Active,0.0,Poor,,,No,,,,,1.0,,,,,
5911,Fayetteville Rd at Obie Dr (NB),35.926332,-78.923325,Active,0.0,Fair,,Trees_Fair,No,,,,,2.0,1.0,,,,
5914,Morehead Ave at Carroll St (EB),35.991715,-78.916333,Active,1.0,Poor,Concrete,,No,Poor,Yes_Single_Door,Yes_Single_Door,,1.0,,0.0,1.0,,2.0
5918,University Dr at Academy Rd (EB),35.967442,-78.943517,Active,0.0,Fair,Concrete,,No,Good,No_SidewalkAbuts,Other,Good,2.0,,2.0,0.0,2.0,
5920,Hardee St at Mimosa St (NB),36.00171,-78.86681,Active,0.0,Good,,,No,,,,,3.0,,,,,
5927,Briggs Ave at Community Gardens (NB),35.9657434,-78.8791762,Active,,,,,,,,,,,,,,,
5928,James St at Nation Ave,35.977255,-78.926258,Active,0.0,Poor,Concrete,,No,,,,,1.0,,,,,
5929,Briggs Ave at Community Gardens (SB),35.965656,-78.8793875,Active,,,,,,,,,,,,,,,
5930,Broad St at Sprunt Ave (SB),36.021278,-78.918981,Active,0.0,Fair,Concrete,Trees_Good,No,,,,Good,2.0,2.0,,,2.0,
5931,Fayetteville St at Brant St (NCCU),35.975694,-78.901329,Active,1.0,Good,Concrete,,Yes,Good,Yes_Two_Doors,Yes_Two_Doors,Good,3.0,,2.0,2.0,2.0,3.0
5932,Chalk Level Rd at Horton Rd (EB),36.051181,-78.910598,Active,0.0,Poor,,Trees_Fair,No,,,,,1.0,1.0,,,,
5933,Riddle Rd at Triangle Day Care (SB),35.95138,-78.899895,Active,0.0,Fair,,,No,,,,Good,2.0,,,,2.0,
5934,Duke St at Jackson St,35.995202,-78.908724,Active,0.0,Poor,Metal,,No,Fair,No_SidewalkWithStrip,Yes_Two_Doors,Excellent,1.0,,1.0,2.0,3.0,
5935,Chalk Level Rd at Convergence St,36.051209,-78.914962,Active,,,,,,,,,,,,,,,
5938,S Roxboro St at Erie St (SB),35.978418,-78.906686,Active,0.0,Fair,,Trees_Fair,No,,,,Good,2.0,1.0,,,2.0,
5939,Otis St at Nelson St,35.97325,-78.905,Active,0.0,,,,,,,,,,,,,,
5940,Hardee St at Benning St (SB),36.00322,-78.86718,Active,1.0,Fair,Metal,,No,,Yes_Single_Door,Yes_Single_Door,Excellent,2.0,,,1.0,3.0,2.0
5942,Roxboro St at Mallard Ave,35.997705,-78.894992,Active,0.0,Good,,,No,,,,,3.0,,,,,
5943,University Dr at Weymouth St (Far),35.96713,-78.94822,Active,0.0,Fair,,,No,Fair,No_SidewalkAbuts,Other,,2.0,,1.0,0.0,,
5944,Freeman Rd at Obsidian Way (Southern HS),35.997104,-78.825341,Active,0.0,Fair,,,No,Poor,No_SidewalkWithStrip,,,2.0,,0.0,,,
5946,Cornwallis Rd at Chapel Hill Rd (Rogers-Herr School),35.974045,-78.935643,Active,0.0,Poor,,Trees_Fair,No,Good,No_SidewalkWithStrip,,Poor,1.0,1.0,2.0,,0.0,
5947,E Weaver St at Cornwallis Rd,35.962904,-78.9159767,Active,0.0,Poor,Metal,,No,Poor,Yes_Two_Doors,Yes_Two_Doors,,1.0,,0.0,2.0,,3.0
5948,Enterprise St at Scout Dr,35.983737,-78.904744,Active,0.0,Fair,,,No,,,,Fair,2.0,,,,1.0,
5949,Dearborn Dr at Deer Run,36.031611,-78.870413,Active,0.0,Fair,,,No,,,,,2.0,,,,,
5954,Dowd St at Hazel St (WB),36.000459,-78.888702,Active,0.0,Fair,,,No,Fair,No_SidewalkAbuts,Other,,2.0,,1.0,0.0,,
5957,Duke University Rd at Chapel Hill Rd,35.996628,-78.92073,Active,1.0,Poor,Metal,,No,Poor,No_SidewalkWithStrip,,Fair,1.0,,0.0,,1.0,
5964,Roxboro Rd at Maynard Ave (NB),36.02707,-78.889746,Active,0.0,Fair,,,No,Poor,No_SidewalkWithStrip,,Poor,2.0,,0.0,,0.0,
5966,Chapel Hill Rd at Vesson Ave,35.983018,-78.930887,Active,0.0,Poor,Concrete,,No,Fair,No_SidewalkWithStrip,,Good,1.0,,1.0,,2.0,
5968,Glenbrook St at Club Blvd (SB),36.024384,-78.877255,Active,0.0,,,,No,Good,No_SidewalkWithStrip,,,,,2.0,,,
5970,Fayetteville Rd at Cook Rd (SB),35.92917,-78.919856,Active,0.0,Poor,,,No,,,,,1.0,,,,,
5971,University Dr at Myra St (WB),35.9665,-78.95292,Active,1.0,Fair,,Trees_Good,No,Good,No_SidewalkAbuts,Other,Good,2.0,2.0,2.0,0.0,2.0,
5973,NC 55 at Meridian Pkwy (NB),35.910294,-78.892919,Active,0.0,Fair,Concrete,,No,,,,,2.0,,,,,
5980,University Dr at Martin Luther King Jr Pkwy (WB),35.963085,-78.960194,Active,1.0,Fair,Concrete,Trees_Good,No,Good,No_SingleDoor,Yes_Single_Door,Fair,2.0,2.0,2.0,1.0,1.0,
5981,N Alston Ave at Geer St (SB),36.003172,-78.886093,Active,0.0,,Metal,Trees_Good,Yes,,,,,,2.0,,,,
5982,Duke University Rd at Swift Ave (WB),35.997328,-78.924603,Active,0.0,Poor,,Trees_Good,No,Poor,No_SidewalkWithStrip,,Good,1.0,2.0,0.0,,2.0,
5983,Duke St at Frasier St,36.0434443,-78.9056425,Active,1.0,Good,Metal,,No,Excellent,Yes_Two_Doors,Yes_Two_Doors,Fair,3.0,,3.0,2.0,1.0,3.0
5984,NC 55 at Dakota St (NB),35.967234,-78.895287,Active,0.0,Good,,,No,Poor,No_SidewalkWithStrip,,Good,3.0,,0.0,,2.0,
5985,Mangum St at Lynch St,36.00739,-78.89373,Active,,,,,,,,,,,,,,,
5987,Otis St at Cecil St,35.97208,-78.90627,Active,0.0,Poor,,,No,,,,Good,1.0,,,,2.0,
5988,Roxboro St at Gray St,35.999005,-78.894099,Active,0.0,Fair,,,No,Poor,No_SidewalkWithStrip,,Good,2.0,,0.0,,2.0,
5989,Avondale Dr at Trinity Ave (SB),36.006855,-78.885575,Active,0.0,Fair,Concrete,,No,Good,No_SidewalkAbuts,Other,Fair,2.0,,2.0,0.0,1.0,
5990,Durham-Chapel Hill Blvd at Car Wash,35.97408,-78.93042,Active,0.0,Fair,,,No,Poor,No_SidewalkWithStrip,,,2.0,,0.0,,,
5992,E Club Blvd at Cascadilla St,36.019858,-78.88636,Active,0.0,Fair,,,No,Good,No_SidewalkWithStrip,,,2.0,,2.0,,,
5993,Duke St at Trinity Ave,36.00497,-78.90555,Active,0.0,Poor,,Trees_Good,No,Poor,No_SidewalkWithStrip,,Good,1.0,2.0,0.0,,2.0,
5994,SW Durham Dr at Durham-Chapel Hill Blvd (NB),35.953664,-78.989582,Active,1.0,Good,Concrete,,No,Good,Yes_Two_Doors,Yes_Two_Doors,Fair,3.0,,2.0,2.0,1.0,3.0
5996,Meriwether Dr at Old Oxford Rd (NB),36.035929,-78.889875,Active,0.0,Fair,,Trees_Good,No,,,,,2.0,2.0,,,,
5998,Green St at Iredell St,36.011751,-78.920886,Active,0.0,Poor,,,No,Excellent,No_SidewalkWithStrip,,Good,1.0,,3.0,,2.0,
5999,Chapel Hill Rd at W Cornwallis Rd (NB),35.975274,-78.936599,Active,0.0,Poor,Concrete,,No,Fair,No_SingleDoor,Yes_Single_Door,Good,1.0,,1.0,1.0,2.0,
6003,Roxboro Rd at Bon Air Ave,36.028286,-78.889972,Active,0.0,Fair,,,No,Poor,No_SidewalkWithStrip,,Fair,2.0,,0.0,,1.0,
6004,NC 55 at Crete St,35.9595703,-78.8933243,Active,0.0,Fair,,Trees_Fair,No,Good,Yes_Single_Door,Yes_Single_Door,,2.0,1.0,2.0,1.0,,2.0
6008,Angier Ave at Beldon Dr,35.94652,-78.83895,Active,0.0,Fair,Concrete,,No,,,,,2.0,,,,,
6012,Erwin Rd at Fulton St (Duke University Hospital),36.0080865,-78.9378766,Active,1.0,Fair,Concrete,Trees_Good,No,Good,No_SidewalkAbuts,Other,Good,2.0,2.0,2.0,0.0,2.0,
6014,Roxboro St at Holloway St,35.99632,-78.8962,Active,1.0,Good,Concrete,,No,Good,No_SingleDoor,Yes_Single_Door,Good,3.0,,2.0,1.0,2.0,
6016,Lawson St at Bacon St (WB),35.97435,-78.884612,Active,1.0,Poor,Metal,,No,Fair,Yes_Two_Doors,Yes_Two_Doors,Fair,1.0,,1.0,2.0,1.0,3.0
6018,Hillsborough Rd at Lawndale Ave (Food Lion),36.014507,-78.9336973,Active,,,,,,,,,,,,,,,
6020,Otis St at Pilot St,35.969541,-78.910683,Active,0.0,Fair,,Trees_Good,No,,,,,2.0,2.0,,,,
6023,Fayetteville St at Lawson St (NCCU),35.9771,-78.900667,Active,1.0,Good,Concrete,Trees_Good,No,Fair,No_SidewalkAbuts,Other,Fair,3.0,2.0,1.0,0.0,1.0,
6024,LaSalle St at Duke Manor Apts (SB),36.015263,-78.946997,Active,0.0,Poor,Concrete,,No,,,,,1.0,,,,,
6026,Cornwallis Rd at Beechwood Ave,35.960998,-78.914996,Active,0.0,Poor,,Trees_Fair,No,,,,Poor,1.0,1.0,,,0.0,
6031,Dowd St at Alston Ave (EB),36.000356,-78.886682,Active,0.0,Poor,Concrete,,No,Poor,No_SidewalkWithStrip,,,1.0,,0.0,,,
6032,Fayetteville St at Cecil St (NB),35.9715452,-78.9010088,Active,0.0,Fair,Concrete,,No,Poor,No_SidewalkWithStrip,,Good,2.0,,0.0,,2.0,
6036,University Dr at Martin Luther King Jr Pkwy (EB),35.962671,-78.960307,Active,1.0,Good,Concrete,,No,Good,Yes_Single_Door,Yes_Single_Door,Fair,3.0,,2.0,1.0,1.0,2.0
6039,E Main St at Goley St (EB),35.985963,-78.884518,Active,0.0,Fair,,Trees_Fair,No,,,,Poor,2.0,1.0,,,0.0,
6040,Hillsborough Rd at Trent Dr (EB),36.0118817,-78.9304598,Active,,,,,,,,,,,,,,,
6045,LaSalle St at Blue Crest Ln,36.013763,-78.948249,Active,0.0,Poor,Concrete,,No,Good,No_SidewalkWithStrip,,Good,1.0,,2.0,,2.0,
6048,Dearborn Dr at Ora Ave,36.030133,-78.870271,Active,0.0,Fair,,,No,,,,,2.0,,,,,
6049,Service Rd at Hillandale Rd (WB),36.016773,-78.936882,Active,0.0,Good,,,No,Good,No_SidewalkAbuts,Other,Fair,3.0,,2.0,0.0,1.0,
6052,Lawson St at Ridgeway Ave,35.973763,-78.887442,Active,1.0,Poor,Metal,Trees_Good,No,Poor,Yes_Single_Door,Yes_Single_Door,Fair,1.0,2.0,0.0,1.0,1.0,2.0
6053,Lawson St at S Briggs Ave (Durham Exchange Club),35.974354,-78.87704,Active,2.0,Poor,Metal,,No,Good,Yes_Two_Doors,Yes_Two_Doors,Good,1.0,,2.0,2.0,2.0,3.0
6054,Cornwallis Rd at Spring Ridge Apts,35.93817,-78.8951,Active,0.0,Fair,,,No,,,,,2.0,,,,,
6057,Chapel Hill Rd at Huron St,35.981986,-78.932409,Active,,,,,,,,,,,,,,,
6058,Lawson St at S Briggs Ave (Ferguson),35.974217,-78.876944,Active,,,,,,,,,,,,,,,
6059,Chapel Hill Rd at Chesterfield Apts,35.990191,-78.924186,Active,0.0,Poor,,,No,,,,,1.0,,,,,
6061,Ross Rd at Fernando St,35.9924,-78.84257,Active,0.0,Fair,,,No,,,,,2.0,,,,,
6064,Roxboro Rd at Omega Rd,36.07557,-78.9095,Active,,,,,,,,,,,,,,,
6067,Olympic Ave at Roxboro Rd,36.036822,-78.897146,Active,0.0,Fair,,Trees_Fair,No,Fair,No_SidewalkWithStrip,,Poor,2.0,1.0,1.0,,0.0,
6068,Erwin Rd at Downing St (WB),36.008863,-78.943709,Active,2.0,Good,Concrete,Trees_Fair,No,Good,Yes_Sidewalk,Other,Fair,3.0,1.0,2.0,0.0,1.0,3.0
6069,Chapel Hill St at Gattis St,35.9968369,-78.9168356,Active,,,,,,,,,,,,,,,
6075,Westgate Dr at South Square (Burger King),35.966287,-78.961148,Active,1.0,Fair,Concrete,,No,Good,,Other,Fair,2.0,,2.0,0.0,1.0,
6076,Douglas St at Pratt St,36.01117,-78.94275,Active,0.0,Poor,,,No,Fair,No_SidewalkWithStrip,,,1.0,,1.0,,,
6077,Fayetteville St at Eagle Campus Dr,35.9736165,-78.9009366,Active,1.0,Good,Concrete,,No,Poor,No_SidewalkAbuts,Other,Fair,3.0,,0.0,0.0,1.0,
6079,Chapel Hill St at Arnette Ave (WB),35.996932,-78.914077,Active,0.0,Fair,,,No,Good,No_SidewalkWithStrip,,Fair,2.0,,2.0,,1.0,
6086,E Main St at Hyde Park Ave (EB),35.98532,-78.88195,Active,0.0,Fair,,Trees_Good,No,Poor,No_SidewalkWithStrip,,Poor,2.0,2.0,0.0,,0.0,
6092,Hardee St at Cheek Rd (SB),36.0047141,-78.8670288,Active,,,,,,,,,,,,,,,
6095,Duke Regional Hospital (SB),36.038147,-78.899033,Active,1.0,Poor,Concrete,Trees_Good,Yes,Good,No_SidewalkAbuts,Other,Poor,1.0,2.0,2.0,0.0,0.0,
6097,NC 55 at Corona St,35.9616676,-78.8942733,Active,0.0,Good,,,No,Good,No_SingleDoor,Yes_Single_Door,,3.0,,2.0,1.0,,
6098,Riddle Rd at Ancroft Ave (SB),35.95272,-78.897066,Active,0.0,Fair,,,No,,,,,2.0,,,,,
6104,Fulton St at Erwin Rd (Duke Hospital Parking Garage),36.008773,-78.937102,Active,1.0,Fair,Concrete,,No,Good,No_SidewalkAbuts,Other,Fair,2.0,,2.0,0.0,1.0,
6109,North Pointe Dr at North Pointe Shopping Center (EB),36.02893,-78.921299,Active,1.0,Poor,Concrete,Trees_Good,No,Good,No_SidewalkWithStrip,,,1.0,2.0,2.0,,,
6110,North Pointe Dr at Broad St (EB),36.028016,-78.91508,Active,1.0,Poor,Concrete,,No,Good,No_SidewalkWithStrip,,Fair,1.0,,2.0,,1.0,
6116,North Pointe Dr at Woodmont Dr (WB),36.030928,-78.926866,Active,0.0,Poor,Concrete,Trees_Fair,No,,,,Poor,1.0,1.0,,,0.0,
6125,Horton Rd at Duke St,36.051277,-78.90699,Active,0.0,Poor,Concrete,,No,Poor,No_SidewalkWithStrip,,Good,1.0,,0.0,,2.0,
6126,Chalk Level Rd at Horton Rd (WB),36.051278,-78.911004,Active,0.0,Poor,Concrete,Trees_Good,No,,,,,1.0,2.0,,,,
6128,Stadium Dr at Wyldewood Rd (Foxfire Apts),36.053469,-78.919688,Active,0.0,Fair,,Trees_Good,No,,,,,2.0,2.0,,,,
6129,New Castle Rd at Wyldewood Rd (SB),36.0514,-78.923594,Active,0.0,Poor,,Trees_Good,No,,,,,1.0,2.0,,,,
6130,Lawson St at Bacon St (EB),35.974105,-78.885177,Active,0.0,Fair,Metal,,No,Fair,No_SidewalkWithStrip,Yes_Two_Doors,Fair,2.0,,1.0,2.0,1.0,
6132,Briggs Ave at Person St (SB 2),35.963091,-78.877635,Active,0.0,Poor,,Trees_Good,No,Fair,No_SidewalkAbuts,Other,,1.0,2.0,1.0,0.0,,
6133,Briggs Ave at Riddle Rd (SB),35.9588,-78.8792,Active,0.0,Good,,,No,Fair,No_SidewalkAbuts,Other,Fair,3.0,,1.0,0.0,1.0,
6136,Capps St at S Alston Ave (EB),35.962295,-78.886911,Active,0.0,Good,,,No,,,,,3.0,,,,,
6137,Capps St at Bacon St (EB),35.965196,-78.88354,Active,0.0,Poor,,,No,,,,,1.0,,,,,
6142,Fayetteville St at Tralea Dr (SB),35.95593,-78.907567,Active,0.0,Poor,,Trees_Good,No,Fair,No_SidewalkAbuts,Other,Fair,1.0,2.0,1.0,0.0,1.0,
6146,Fayetteville St at Pilot St (NB),35.963849,-78.907069,Active,1.0,Fair,Concrete,,Yes,Fair,No_SidewalkWithStrip,,Fair,2.0,,1.0,,1.0,
6147,Fayetteville St at Cornwallis Rd (NB),35.960317,-78.910241,Active,0.0,Fair,Concrete,Trees_Fair,No,Fair,No_SidewalkAbuts,Other,Fair,2.0,1.0,1.0,0.0,1.0,
6153,Fayetteville Rd at Dunhill Dr (Pine Ridge Center),35.916289,-78.931658,Active,0.0,Fair,,,No,Good,No_SidewalkWithStrip,,,2.0,,2.0,,,
6154,Roxboro St at Cornwallis Rd,35.9656582,-78.9183735,Active,0.0,Fair,Metal,,No,Fair,No_SidewalkWithStrip,Yes_Single_Door,Fair,2.0,,1.0,1.0,1.0,
6155,Roxboro Rd at Crutchfield St (Duke Regional Hospital),36.038368,-78.898424,Active,0.0,Good,Concrete,,No,Good,Yes_Two_Doors,Yes_Two_Doors,Fair,3.0,,2.0,2.0,1.0,3.0
6156,Carver St at Meriwether Dr,36.04361,-78.89153,Active,0.0,Good,,,No,Good,No_SidewalkWithStrip,,,3.0,,2.0,,,
6157,Club Blvd at Lindbergh St,36.023083,-78.878771,Active,0.0,,,,No,,,,,,,,,,
6158,Dowd St at Gurley St (WB),36.000394,-78.891915,Active,0.0,Fair,Concrete,,No,Poor,No_SidewalkWithStrip,,Good,2.0,,0.0,,2.0,
6159,Dowd St at Gurley St (EB),36.000316,-78.891527,Active,0.0,Fair,,,No,Poor,No_SidewalkWithStrip,,Good,2.0,,0.0,,2.0,
6160,Dowd St at Hazel St (EB),36.000336,-78.888906,Active,0.0,Good,Concrete,,No,Poor,No_SidewalkWithStrip,,,3.0,,0.0,,,
6161,Dowd St at Alston Ave (WB),36.000449,-78.88648,Active,0.0,Fair,,,No,Poor,No_SidewalkWithStrip,,,2.0,,0.0,,,
6162,Duke St at Cobb St,35.989034,-78.908988,Active,0.0,Poor,,Trees_Fair,No,Good,No_SingleDoor,Yes_Single_Door,Good,1.0,1.0,2.0,1.0,2.0,
6163,Chapel Hill Rd at W Cornwallis Rd (Yates Baptist Church),35.9737353,-78.9369972,Active,0.0,Fair,,Trees_Fair,No,Good,No_SidewalkWithStrip,,Fair,2.0,1.0,2.0,,1.0,
6164,University Dr at Shannon Rd (WB),35.966229,-78.954307,Active,0.0,Good,,Trees_Good,No,Good,No_SidewalkAbuts,Other,Good,3.0,2.0,2.0,0.0,2.0,
6165,Old Chapel Hill Rd at Garrett Rd (WB),35.949879,-78.96766,Active,0.0,Fair,,,No,Good,No_SidewalkWithStrip,,Fair,2.0,,2.0,,1.0,
6167,Chapel Hill Rd at Colonial Apts (NB),35.970492,-78.938627,Active,0.0,Fair,Metal,,No,,Yes_Single_Door,Yes_Single_Door,Excellent,2.0,,,1.0,3.0,2.0
6172,Hardee St at Holloway St,35.99245,-78.865885,Active,0.0,Fair,Concrete,,No,,,,,2.0,,,,,
6177,Lawson St at Sima Ave (WB),35.974569,-78.890915,Active,1.0,Good,Metal,,No,Fair,Yes_Two_Doors,Yes_Two_Doors,Fair,3.0,,1.0,2.0,1.0,3.0
6182,Morgan St at Mangum St,35.99747,-78.89833,Active,0.0,Fair,Concrete,,No,Fair,Yes_Sidewalk,Other,Good,2.0,,1.0,0.0,2.0,3.0
6193,Fayetteville St at Barbee Rd (SB),35.9360803,-78.9086299,Active,,,,,,,,,,,,,,,
6196,University Dr at Myra St (EB),35.966524,-78.951709,Active,0.0,Fair,,Trees_Fair,No,Fair,No_SidewalkWithStrip,,,2.0,1.0,1.0,,,
6197,Witherspoon Blvd at McFarland Dr (Patterson Place Park-and-Ride),35.9509,-78.989783,Active,1.0,Poor,Concrete,Trees_Good,No,Fair,No_SidewalkAbuts,Other,Poor,1.0,2.0,1.0,0.0,0.0,
6198,Mt. Moriah Rd at Danziger Dr,35.949503,-78.994395,Active,0.0,Good,Concrete,Trees_Fair,No,Good,No_SidewalkWithStrip,,Fair,3.0,1.0,2.0,,1.0,
6201,Hillandale Rd at Hillandale Elementary,36.05318,-78.93487,Active,0.0,Poor,,Trees_Fair,No,Good,No_SidewalkWithStrip,,,1.0,1.0,2.0,,,
6202,Horton Rd at Sugarwood Pl,36.05733,-78.933825,Active,0.0,Fair,,,No,,,,,2.0,,,,,
6203,Horton Rd at Guess Rd (Harris Teeter),36.05737,-78.93069,Active,1.0,Poor,Concrete,,No,Good,No_SingleDoor,Yes_Single_Door,Fair,1.0,,2.0,1.0,1.0,
6204,Guess Rd at Horton Rd (Walgreens),36.056876,-78.929312,Active,1.0,Good,Concrete,Trees_Fair,No,Good,Yes_Single_Door,Yes_Single_Door,Poor,3.0,1.0,2.0,1.0,0.0,2.0
6206,Guess Rd at Crystal Lake Rd,36.0497,-78.92945,Active,0.0,Fair,,Trees_Fair,No,Fair,No_SidewalkWithStrip,,,2.0,1.0,1.0,,,
6207,Guess Rd at Bogarde St,36.04375,-78.92957,Active,0.0,Good,Concrete,Trees_Fair,No,Good,No_SidewalkWithStrip,,,3.0,1.0,2.0,,,
6210,Hillandale Rd at Pinetree Ct,36.044061,-78.935233,Active,0.0,Fair,,Trees_Fair,No,Poor,No_SidewalkWithStrip,,Good,2.0,1.0,0.0,,2.0,
6211,Hillandale Rd at Samuel Dr,36.04822,-78.93616,Active,1.0,Fair,Concrete,Trees_Good,No,Good,Yes_Two_Doors,Yes_Two_Doors,Fair,2.0,2.0,2.0,2.0,1.0,3.0
6212,Hillandale Rd at Croasdaile Farms,36.050744,-78.935429,Active,0.0,Poor,,,No,Good,No_SidewalkWithStrip,,Good,1.0,,2.0,,2.0,
6221,Brier Leaf Ln at Stonebrook Terrace,35.9096072,-78.7869239,Active,,,,,,,,,,,,,,,
6224,Brier Leaf Ln at Little Brier Creek Ln,35.91134,-78.7859,Active,,,,,,,,,,,,,,,
6225,Brier Creek Pkwy at Little Brier Creek Ln,35.90927,-78.78484,Active,,,,,,,,,,,,,,,
6226,TW Alexander Dr at Glenwood Ave,35.9183079,-78.7865754,Active,,,,,,,,,,,,,,,
6241,Rigsbee Ave at Seminary St,35.99933,-78.89981,Active,1.0,Poor,Concrete,,Yes,Good,Yes_Sidewalk,Other,Good,1.0,,2.0,0.0,2.0,3.0
6242,Rigsbee Ave at Corporation St (NB),36.001766,-78.899917,Active,0.0,Fair,,Other,No,Good,Yes_Sidewalk,Other,Good,2.0,,2.0,0.0,2.0,3.0
6243,W Geer St at Rigsbee Ave,36.00374,-78.89963,Active,0.0,Poor,Concrete,,No,Fair,No_SidewalkWithStrip,,Fair,1.0,,1.0,,1.0,
6244,W Geer St at Glendale Ave,36.00376,-78.89647,Active,0.0,Fair,,,No,Good,No_SidewalkWithStrip,,Fair,2.0,,2.0,,1.0,
6245,Geer St at Glendale Ave,36.00384,-78.89649,Active,0.0,Good,,Trees_Good,No,Fair,No_SidewalkWithStrip,,Fair,3.0,2.0,1.0,,1.0,
6246,Geer St at Rigsbee Ave,36.00382,-78.89951,Active,0.0,Poor,Concrete,,No,Fair,No_SidewalkWithStrip,,Fair,1.0,,1.0,,1.0,
6247,Rigsbee Ave at Broadway St,36.00095,-78.90001,Active,0.0,Fair,,,No,Good,Yes_Sidewalk,Other,Good,2.0,,2.0,0.0,2.0,3.0
6248,Rigsbee Ave at Seminary St,35.99942,-78.89997,Active,0.0,Fair,Concrete,,No,Poor,No_SidewalkWithStrip,,Good,2.0,,0.0,,2.0,
6250,Renaissance Center at Renaissance Pkwy,35.9012664,-78.9384825,Active,,,,,,,,,,,,,,,
6251,Renaissance Center at Southpoint Shopping Center,35.904003,-78.937392,Active,1.0,Fair,Metal,,No,Good,No_SidewalkAbuts,Other,Good,2.0,,2.0,0.0,2.0,
6252,Renaissance Pkwy at Renaissance Village Park-and-Ride,35.902963,-78.953911,Active,1.0,Good,Concrete,Trees_Good,No,Good,Yes_Two_Doors,Yes_Two_Doors,Good,3.0,2.0,2.0,2.0,2.0,3.0
6256,Fayetteville St at Cook Rd (SB),35.9528158,-78.9056188,Active,1.0,Fair,Metal,,No,Good,No_SidewalkAbuts,Other,Fair,2.0,,2.0,0.0,1.0,
6257,Fayetteville St at Cook Rd (Hillside HS),35.95325,-78.90559,Active,2.0,Good,Metal,,No,Fair,Yes_Two_Doors,Yes_Two_Doors,Fair,3.0,,1.0,2.0,1.0,3.0
6258,Fayetteville Rd at Tralea Dr (Mt Zion Church),35.955957,-78.907293,Active,0.0,Poor,Concrete,,No,Poor,No_SidewalkAbuts,Other,Fair,1.0,,0.0,0.0,1.0,
6261,Miami Blvd at Stirrup Creek Dr (PBM Graphics),35.920121,-78.848985,Active,0.0,Poor,,,No,Fair,No_SidewalkWithStrip,,,1.0,,1.0,,,
6263,Miami Blvd at Ellis Rd (Bethesda Elementary),35.939874,-78.8398574,Active,0.0,Fair,,,No,Fair,No_SidewalkWithStrip,,Fair,2.0,,1.0,,1.0,
6264,Holloway St at Rummel St,35.987727,-78.847973,Active,1.0,Poor,Concrete,,No,,No_SidewalkAbuts,Other,,1.0,,,0.0,,
6265,Holloway St at Lynn Rd,35.9868,-78.84421,Active,0.0,Good,Concrete,,No,,,,,3.0,,,,,
6266,Miami Blvd at New Haven Dr,35.936355,-78.842472,Active,0.0,Fair,,,No,Poor,No_SidewalkWithStrip,,,2.0,,0.0,,,
6267,TW Alexander Dr at Miami Blvd (EB),35.9234847,-78.845466,Active,1.0,Poor,Concrete,,No,Good,Yes_Single_Door,Yes_Single_Door,Fair,1.0,,2.0,1.0,1.0,2.0
6268,TW Alexander Dr at Centerpoint (Wesco),35.9217641,-78.8331177,Active,,,,,,,,,,,,,,,
6269,TW Alexander Dr at Roche Dr (LabCorp),35.918783,-78.824637,Active,0.0,Poor,Concrete,,No,,No_Other,,,1.0,,,,,
6270,TW Alexander Dr at Creekside Townhomes,35.922404,-78.837375,Active,0.0,,,Trees_Fair,No,,,,,,1.0,,,,
6272,TW Alexander Dr at Miami Blvd (WB),35.9239,-78.845353,Active,1.0,Poor,Concrete,,No,Good,No_SidewalkWithStrip,,Fair,1.0,,2.0,,1.0,
6273,Miami Blvd at Methodist St,35.936412,-78.842152,Active,0.0,Fair,,Trees_Fair,No,Good,No_SidewalkWithStrip,,,2.0,1.0,2.0,,,
6274,NC 54 at S Alston Ave (EB),35.9006,-78.889397,Active,0.0,Fair,Concrete,,No,,,,Fair,2.0,,,,1.0,
6275,S Alston Ave at Kestrel Heights School (SB),35.898656,-78.889065,Active,0.0,,Concrete,Trees_Fair,No,Fair,No_SingleDoor,Yes_Single_Door,,,1.0,1.0,1.0,,
6276,S Alston Ave at Duke Health (SB),35.887359,-78.885144,Active,0.0,,,Trees_Fair,No,Good,No_SidewalkWithStrip,,,,1.0,2.0,,,
6277,S Alston Ave at Falls Pointe Apts (SB),35.884218,-78.885886,Active,1.0,Poor,Metal,,No,Fair,Yes_Single_Door,Yes_Single_Door,,1.0,,1.0,1.0,,2.0
6278,NC 55 at Sedwick Rd (NB),35.89021,-78.89596,Active,0.0,Good,,Trees_Fair,No,Fair,No_SidewalkWithStrip,,Poor,3.0,1.0,1.0,,0.0,
6279,NC 55 at Golden Corral (NB),35.8971,-78.89687,Active,0.0,Good,,Trees_Good,No,Good,No_SidewalkWithStrip,,,3.0,2.0,2.0,,,
6281,TW Alexander Dr at Stirrup Creek Dr,35.9217954,-78.841755,Active,1.0,Poor,Concrete,,No,Good,Yes_Two_Doors,Yes_Two_Doors,Fair,1.0,,2.0,2.0,1.0,3.0
6283,NC 55 at Allendown Dr (NB),35.8991122,-78.8964078,Active,0.0,Good,,Trees_Fair,No,Poor,No_SidewalkWithStrip,,Fair,3.0,1.0,0.0,,1.0,
6286,Chapel Dr at Duke University Rd (Duke News),35.998067,-78.933441,Active,0.0,Poor,,,No,Good,No_SidewalkWithStrip,,Good,1.0,,2.0,,2.0,
6287,S Alston Ave at Englert Dr (SB),35.8955,-78.88905,Active,0.0,Poor,,Trees_Fair,No,,,,,1.0,1.0,,,,
6289,E Geer St at Midland Terrace (EB),36.01428,-78.86316,Active,0.0,Poor,,,No,,,,Good,1.0,,,,2.0,
