Stop Code,Stop Name,Latitude,Longitude,Status,Shelter Quantity,Area_Light,Trash Can,Site_Shade,Real Time Sign,Sidewalk Condition,ADA condition,Landing Pad,Crosswalk,Area Light Score,Site Shade Score,Sidewalk Condition Score,Landing Pad Score,Crosswalk Score,ADA Score
5407,Tom Wilkinson Rd at Roxboro Rd,36.0950678,-78.9116757,Active,0.0,Poor,Concrete,Trees_Fair,No,,,,Good,1.0,1.0,,,2.0,
5409,Clayton Rd at Chandler Rd,35.995997,-78.830995,Active,0.0,Fair,,,No,,,,,2.0,,,,,
5412,Hinson Dr at Waring St,36.030322,-78.87764,Active,1.0,Fair,Other,,No,Fair,Yes_Two_Doors,Yes_Two_Doors,,2.0,,1.0,2.0,,3.0
5415,Duke St at North Duke Crossing,36.049902,-78.905608,Active,,,,,,,,,,,,,,,
5416,Glenbrook Dr at Dubonnet Pl (NB),36.02645,-78.87767,Active,0.0,,,Trees_Fair,No,,,,,,1.0,,,,
5419,Holloway St at Chandler Rd,35.985884,-78.840216,Active,0.0,Fair,,,No,,,,,2.0,,,,,
5423,Enterprise St at Roxboro St (EB),35.9835527,-78.9031408,Active,0.0,Fair,,,No,Poor,No_SidewalkAbuts,Other,Fair,2.0,,0.0,0.0,1.0,
5424,S Roxboro St at Bond St,35.980161,-78.905344,Active,0.0,Fair,,,No,,,,Good,2.0,,,,2.0,
5429,Hillsborough Rd at US 15-501 (EB),36.021548,-78.951737,Active,0.0,Fair,,,No,Good,No_SidewalkWithStrip,,Fair,2.0,,2.0,,1.0,
5430,Riddle Rd at Kirby St (SB),35.955723,-78.893212,Active,0.0,Poor,,,No,,,,,1.0,,,,,
5431,Riddle Rd at NC 55 (WB),35.9561702,-78.8898354,Active,,,,,,,,,,,,,,,
5432,Riddle Rd at NC 55 (EB),35.9560965,-78.8893901,Active,,,,,,,,,,,,,,,
5433,Main St at Morgan St (WB),36.0015485,-78.9115431,Active,1.0,Good,Metal,,No,Good,Yes_Sidewalk,Other,Fair,3.0,,2.0,0.0,1.0,3.0
5434,Milton Rd at Long Cresent Dr,36.091973,-78.91416,Active,0.0,Fair,,,No,Fair,No_SidewalkWithStrip,,,2.0,,1.0,,,
5435,NC 55 at Alston Ave (NCCU),35.9706648,-78.8947985,Active,1.0,Good,Metal,,No,Good,Yes_Two_Doors,Yes_Two_Doors,Poor,3.0,,2.0,2.0,0.0,3.0
5436,Meriwether Dr at Pickwick Trail (SB),36.041878,-78.889984,Active,1.0,,Concrete,,No,Good,Yes_Single_Door,Yes_Single_Door,Good,,,2.0,1.0,2.0,2.0
5438,Duke St at Corporation St,36.002322,-78.90632,Active,0.0,,,,No,Good,,,Fair,,,2.0,,1.0,
5439,Gregson St at Lamond Ave,36.00233,-78.90835,Active,0.0,Poor,,,No,Good,No_SidewalkWithStrip,,Good,1.0,,2.0,,2.0,
5444,Dowd St at Roxboro Rd (EB),36.000292,-78.893429,Active,0.0,Good,Concrete,,No,Fair,No_SidewalkWithStrip,,Good,3.0,,1.0,,2.0,
5445,Raynor St at The Village (WB),35.994284,-78.869756,Active,1.0,Fair,Concrete,Trees_Fair,Yes,Fair,No_SidewalkAbuts,Other,Fair,2.0,1.0,1.0,0.0,1.0,
5446,Guess Rd at Ellen St,36.03985,-78.92963,Active,0.0,Good,,,No,Fair,No_SidewalkWithStrip,,Fair,3.0,,1.0,,1.0,
5447,Chapel Hill Rd at Palmer St (WB),35.988573,-78.925313,Active,0.0,Poor,,,No,Poor,No_SidewalkAbuts,Other,Good,1.0,,0.0,0.0,2.0,
5450,Meriwether Dr at Oxford Ct,36.038614,-78.890029,Active,0.0,,,Trees_Fair,No,,,,,,1.0,,,,
5451,Olympic Ave at Roxboro Rd,36.036787,-78.896935,Active,0.0,Fair,,,No,,,,Poor,2.0,,,,0.0,
5453,Cornwallis Rd at Fayetteville Rd,35.9602773,-78.9114336,Active,0.0,Poor,,,No,Fair,No_SidewalkWithStrip,,Poor,1.0,,1.0,,0.0,
5456,Shannon Rd at Martin Luther King Jr Pkwy (South Square Townhomes),35.962639,-78.956324,Active,,,,,,,,,,,,,,,
5460,Erwin Rd at LaSalle St (EB),36.007986,-78.945586,Active,0.0,Good,,,No,Fair,No_SidewalkAbuts,Other,Fair,3.0,,1.0,0.0,1.0,
5463,Fayetteville Rd at Obie Dr (SB),35.926656,-78.92316,Active,0.0,Fair,,Trees_Fair,No,,,,,2.0,1.0,,,,
5464,Morehead Ave at Vickers Ave (EB),35.991578,-78.912047,Active,0.0,Poor,,Trees_Good,No,Poor,No_SidewalkWithStrip,,,1.0,2.0,0.0,,,
5465,Broad St at Markham Ave (NB),36.01058,-78.91947,Active,1.0,Good,Concrete,,No,Poor,No_SidewalkWithStrip,,Good,3.0,,0.0,,2.0,
5466,Roxboro Rd at Argonne Dr (Northern High School),36.0634339,-78.9041156,Active,,,,,,,,,,,,,,,
5468,Hillsborough Rd at LaSalle St,36.0197,-78.94693,Active,0.0,Fair,Metal,,No,Fair,Yes_Two_Doors,Yes_Two_Doors,Fair,2.0,,1.0,2.0,1.0,3.0
5472,Old Oxford Rd at Dearborn Dr (EB),36.037234,-78.886362,Active,0.0,Fair,,Trees_Fair,No,,,,,2.0,1.0,,,,
5473,Old Oxford Rd at Dearborn Dr (WB),36.038273,-78.885425,Active,0.0,Fair,,Trees_Fair,No,Poor,,,,2.0,1.0,0.0,,,
5475,Club Blvd at Stephenson St,36.021567,-78.88255,Active,0.0,Poor,,Trees_Fair,No,,,,,1.0,1.0,,,,
5477,Ross Rd at Charlestowne Apts,35.99243,-78.84488,Active,0.0,Poor,,Trees_Good,No,,,,,1.0,2.0,,,,
5478,Club Blvd at Dearborn Dr,36.027159,-78.870647,Active,,,,,,,,,,,,,,,
5479,Cornwallis Rd at Weaver St,35.9626,-78.916008,Active,0.0,Poor,Metal,Trees_Good,No,Poor,No_SidewalkWithStrip,,Poor,1.0,2.0,0.0,,0.0,
5480,Flowers Dr at Duke Gardens (NB),36.001234,-78.936286,Active,0.0,Good,Metal,Trees_Good,No,Good,No_SidewalkAbuts,Other,Good,3.0,2.0,2.0,0.0,2.0,
5481,Roxboro Rd at Davidson Ave (NB),36.01932,-78.88985,Active,,,,,,,,,,,,,,,
5482,Roxboro Rd at Lynch St,36.00713,-78.89235,Active,0.0,Poor,,Trees_Fair,No,Poor,No_SidewalkWithStrip,,Good,1.0,1.0,0.0,,2.0,
5484,Duke University Rd at Underwood Ave (WB),35.996844,-78.922128,Active,1.0,Good,Metal,Trees_Good,No,Good,Yes_Two_Doors,Yes_Two_Doors,Good,3.0,2.0,2.0,2.0,2.0,3.0
5489,Dearborn Dr at Wiley Ave,36.029217,-78.870369,Active,0.0,Fair,,Trees_Fair,No,,,,,2.0,1.0,,,,
5490,Chapel Hill Rd at Ward St,35.983177,-78.930668,Active,0.0,Poor,Concrete,Trees_Fair,Yes,Fair,No_SidewalkWithStrip,,Good,1.0,1.0,1.0,,2.0,
5492,Dearborn Dr at Cannada Ave (NB),36.038636,-78.882398,Active,0.0,Fair,,Trees_Fair,No,,,,,2.0,1.0,,,,
5495,W Club Blvd at Clarendon St,36.017198,-78.918167,Active,,,,,,,,,,,,,,,
5496,Dearborn Dr at Maplewood Dr (north),36.034678,-78.86792,Active,0.0,Fair,,,No,,,,,2.0,,,,,
5497,Roxboro St at Erie St (CC Spaulding Elementary),35.9786517,-78.906386,Active,0.0,Good,,,No,Good,Yes_Two_Doors,Yes_Two_Doors,Good,3.0,,2.0,2.0,2.0,3.0
5498,Holloway St at Guthrie Ave (EB),35.99414,-78.87553,Active,0.0,Poor,,,No,Good,Yes_Two_Doors,Yes_Two_Doors,Fair,1.0,,2.0,2.0,1.0,3.0
5499,Meriwether Dr at Pickwick Trail (NB),36.041873,-78.889813,Active,1.0,Fair,Metal,Trees_Fair,No,Excellent,No_SingleDoor,Yes_Single_Door,Good,2.0,1.0,3.0,1.0,2.0,
5501,Chapel Hill Rd at Chapel Ridge Apts,35.984739,-78.929553,Active,0.0,Poor,,Trees_Good,No,Poor,No_SidewalkWithStrip,,Good,1.0,2.0,0.0,,2.0,
5503,North Pointe Dr at Red Roof Inn (EB),36.03029,-78.923029,Active,0.0,Fair,,,No,Good,No_SidewalkWithStrip,,,2.0,,2.0,,,
5505,Holloway St at Alston Ave (Long Meadow Park) (WB),35.994552,-78.884742,Active,0.0,Poor,Concrete,Trees_Fair,No,Good,No_SidewalkAbuts,Other,Fair,1.0,1.0,2.0,0.0,1.0,
5506,Lawson St at DTCC Library (WB),35.974428,-78.882757,Active,0.0,Poor,,,No,Good,No_SidewalkWithStrip,,Fair,1.0,,2.0,,1.0,
5507,Chapel Hill St at Gregson St (WB),35.997049,-78.909564,Active,0.0,Fair,Concrete,Trees_Fair,No,Good,No_SidewalkWithStrip,,Fair,2.0,1.0,2.0,,1.0,
5508,Chapel Hill Rd at Morehead Ave (SB),35.991518,-78.922917,Active,0.0,Poor,,Trees_Fair,No,,,,Good,1.0,1.0,,,2.0,
5509,Old Farm Rd at Seven Oaks Rd,36.067087,-78.904996,Active,0.0,Good,,Trees_Fair,No,Fair,No_SidewalkWithStrip,,Poor,3.0,1.0,1.0,,0.0,
5511,Hillsborough Rd at US 15-501 SB (WB),36.021637,-78.951409,Active,0.0,Fair,Concrete,,No,Good,No_SidewalkWithStrip,,Fair,2.0,,2.0,,1.0,
5512,Alston Ave at Cecil St (NCCU),35.97150361,-78.89485941,Active,,,,,,,,,,,,,,,
5513,Roxboro Rd at Horton Rd,36.050261,-78.903612,Active,1.0,Good,Concrete,Trees_Fair,No,Fair,No_SingleDoor,Yes_Single_Door,Fair,3.0,1.0,1.0,1.0,1.0,
5516,Duke St at Carver St,36.04005,-78.90587,Active,0.0,Good,,,No,,,,Poor,3.0,,,,0.0,
5517,Fayetteville Rd at Southpoint Crossing Dr (SB),35.913491,-78.933378,Active,0.0,Fair,,,No,Good,,Yes_Two_Doors,Poor,2.0,,2.0,2.0,0.0,
5518,Fayetteville St at Pekoe St,35.9733322,-78.9011141,Active,,,,,,,,,,,,,,,
5519,University Dr at Hill St (Forest Hills Shopping Center),35.98523,-78.91039,Active,1.0,Fair,Metal,,No,Excellent,No_SingleDoor,Yes_Single_Door,Excellent,2.0,,3.0,1.0,3.0,
5522,Dearborn Dr at Cannada Ave (Disciples Church),36.038529,-78.880921,Active,0.0,Fair,,,No,Good,Yes_Other,,,2.0,,2.0,,,1.0
5524,Mangum St at Trinity Ave,36.005518,-78.8942,Active,0.0,Fair,,,No,Poor,No_SidewalkWithStrip,,Fair,2.0,,0.0,,1.0,
5525,Hinson Dr at Davinci St,36.03179,-78.878167,Active,0.0,Poor,,Trees_Fair,Yes,Fair,No_SingleDoor,Yes_Single_Door,,1.0,1.0,1.0,1.0,,
5526,Hillsborough Rd at Erwin Square,36.01038,-78.92509,Active,0.0,Good,,Trees_Good,No,Good,No_SingleDoor,Yes_Single_Door,Good,3.0,2.0,2.0,1.0,2.0,
5530,Cornwallis Rd at Century Oaks Dr (NB),35.94103,-78.89807,Active,0.0,Fair,,Trees_Fair,No,,,,,2.0,1.0,,,,
5532,S Alston Ave at Dupree St (NB),35.976341,-78.892879,Active,0.0,Good,,Trees_Good,No,Fair,No_SidewalkWithStrip,,Poor,3.0,2.0,1.0,,0.0,
5533,University Dr at Old Chapel Hill Rd (EB),35.96717,-78.94603,Active,0.0,Good,,Trees_Fair,No,Good,No_SidewalkWithStrip,,Good,3.0,1.0,2.0,,2.0,
5540,Chapel Hill Rd at Pickett Rd (SB),35.97678,-78.93625,Active,0.0,Fair,Concrete,,No,Poor,No_SidewalkAbuts,Other,Good,2.0,,0.0,0.0,2.0,
5543,Guess Rd at Lombard Ave (NB),36.0361,-78.92928,Active,0.0,Fair,,,No,,,,Poor,2.0,,,,0.0,
5544,Fayetteville St at Homeland Ave (SB),35.96207,-78.9089,Active,0.0,Fair,Concrete,,No,Poor,No_SidewalkWithStrip,,Poor,2.0,,0.0,,0.0,
5547,Sima Ave at Bacon St,35.97767,-78.88435,Active,0.0,Poor,,,No,Good,No_SidewalkAbuts,Other,,1.0,,2.0,0.0,,
5549,Fayetteville St at Linwood Ave (Lincoln Health Center),35.9812078,-78.8992314,Active,1.0,Good,Concrete,,No,Good,No_SidewalkAbuts,Other,Fair,3.0,,2.0,0.0,1.0,
5550,Hardee St at Delano St (Hardee Terrace),35.997496,-78.864402,Active,0.0,Good,,Trees_Fair,No,,,,,3.0,1.0,,,,
5552,NC 55 at Meridian Pkwy (SB),35.912198,-78.892648,Active,0.0,Fair,,Trees_Fair,No,Fair,No_SidewalkWithStrip,,,2.0,1.0,1.0,,,
5553,Milton Rd at Eno Valley Elementary (NB),36.08645,-78.912,Active,0.0,Fair,,,No,,,,,2.0,,,,,
5557,Morreene Rd at Andrews Rd,36.013029,-78.95629,Active,0.0,Poor,,,No,,,,,1.0,,,,,
5559,Willard St at Blackwell St (South Parking Deck),35.991862,-78.906599,Active,0.0,Fair,,Trees_Good,No,Good,No_SidewalkWithStrip,,Good,2.0,2.0,2.0,,2.0,
5561,Leon St at N Buchanan Blvd (EB),36.025475,-78.910534,Active,1.0,Fair,Metal,Trees_Good,No,Fair,Yes_Two_Doors,Yes_Two_Doors,Good,2.0,2.0,1.0,2.0,2.0,3.0
5563,Duke St at Fairfield St,36.047832,-78.905718,Active,0.0,Good,,,No,,,,Fair,3.0,,,,1.0,
5564,Morreene Rd at Erwin Rd,36.00382,-78.95275,Active,0.0,Poor,,,No,Good,No_SidewalkAbuts,Other,Fair,1.0,,2.0,0.0,1.0,
5565,Fayetteville St at Fayetteville Street Elementary School,35.964905,-78.906124,Active,0.0,Fair,,,No,Fair,No_SidewalkWithStrip,,Good,2.0,,1.0,,2.0,
5567,Fayetteville Rd at Juliette Dr (SB),35.931954,-78.916697,Active,0.0,Fair,,,No,Good,No_SidewalkWithStrip,,Fair,2.0,,2.0,,1.0,
5568,Meriwether Dr at Old Oxford Rd (SB),36.03602,-78.89013,Active,1.0,Good,Concrete,Trees_Fair,No,Fair,Yes_Two_Doors,Yes_Two_Doors,,3.0,1.0,1.0,2.0,,3.0
5569,Hillsborough Rd at LaSalle St (Durham Festival Center),36.019752,-78.947568,Active,1.0,Fair,Concrete,Trees_Good,No,Good,No_SingleDoor,Yes_Single_Door,Fair,2.0,2.0,2.0,1.0,1.0,
5570,Garrett Rd at Durham-Chapel Hill Blvd (NB),35.958731,-78.974587,Active,1.0,Poor,Concrete,Trees_Fair,No,Good,No_SingleDoor,Yes_Single_Door,Good,1.0,1.0,2.0,1.0,2.0,
5572,Cornwallis Rd at Bainbridge Dr (SB),35.939637,-78.896774,Active,0.0,Poor,,Trees_Good,No,,,,,1.0,2.0,,,,
5573,Holloway St at Elizabeth St (EB),35.994511,-78.890385,Active,0.0,Fair,,Trees_Fair,No,Poor,No_SidewalkWithStrip,,Fair,2.0,1.0,0.0,,1.0,
5574,Durham-Chapel Hill Blvd at Hope Valley Rd (EB),35.97392,-78.93305,Active,0.0,Fair,,,No,,,,,2.0,,,,,
5575,Roxboro St at Charles St,35.9664811,-78.9168035,Active,,,,,,,,,,,,,,,
5578,Fayetteville St at Simmons St,35.9819872,-78.8991683,Active,0.0,Fair,Metal,,No,Fair,No_SidewalkWithStrip,,Fair,2.0,,1.0,,1.0,
5579,North Pointe Dr at North Pointe Shopping Center (WB),36.028632,-78.920304,Active,1.0,Fair,Concrete,,No,Good,No_SidewalkWithStrip,,,2.0,,2.0,,,
5580,Fayetteville St at Burlington Ave (SB),35.96887,-78.90273,Active,,,,,,,,,,,,,,,
5581,E Club Blvd at Lindbergh St,36.022849,-78.878892,Active,0.0,Fair,,Trees_Good,No,,,,,2.0,2.0,,,,
5582,Angier Ave at East End Ave (WB),35.97445,-78.86823,Active,0.0,Fair,,,No,Poor,No_SidewalkAbuts,Other,,2.0,,0.0,0.0,,
5584,Hardee St at Fiske St,35.99881,-78.86459,Active,0.0,Poor,Concrete,Trees_Fair,No,,No_Other,,,1.0,1.0,,,,
5590,Hillandale Rd at Croasdaile Crossing,36.031655,-78.935952,Active,1.0,Good,Concrete,,No,Good,No_SidewalkAbuts,Other,Fair,3.0,,2.0,0.0,1.0,
5593,Lednum St at Murray Ave,36.027209,-78.909612,Active,0.0,Fair,,Trees_Fair,No,,,,,2.0,1.0,,,,
5594,Hillsborough Rd at Trent Dr (WB),36.01206612,-78.93040821,Active,0.0,Poor,,,No,Poor,No_SidewalkWithStrip,,Good,1.0,,0.0,,2.0,
5595,Duke St at Markham Ave,36.009649,-78.905438,Active,0.0,Poor,,,No,Fair,,,Good,1.0,,1.0,,2.0,
5596,Foushee St at Avondale Dr (EB),36.016151,-78.887701,Active,0.0,Good,,,No,,,,Good,3.0,,,,2.0,
5598,Fayetteville Rd at Geneva Dr (SB),35.9205413,-78.9291726,Active,0.0,Good,,Trees_Fair,No,Good,No_SidewalkWithStrip,,Fair,3.0,1.0,2.0,,1.0,
5600,Carver St at Commons Blvd (WB),36.041499,-78.894746,Active,1.0,Fair,Concrete,Trees_Good,No,Fair,No_SidewalkAbuts,Other,Good,2.0,2.0,1.0,0.0,2.0,
5601,Cornwallis Rd at Industry Ln,35.94278,-78.89973,Active,0.0,Poor,,,No,,,,,1.0,,,,,
5603,Hardee St at Landon St (NB),36.00001,-78.86535,Active,,,,,,,,,,,,,,,
5604,Crest St at Zelko Ct,36.01276,-78.941013,Active,0.0,Good,,,No,,,,,3.0,,,,,
5612,Chapel Hill St at Gregson St (EB),35.996873,-78.911517,Active,0.0,,,,,,,,,,,,,,
5613,University Dr at Old Chapel Hill Rd (WB),35.967352,-78.947182,Active,0.0,Fair,,Trees_Fair,No,Good,No_SidewalkWithStrip,,Good,2.0,1.0,2.0,,2.0,
5616,Cornwallis Rd at Yorktown Ave (SB),35.936476,-78.893543,Active,0.0,Fair,Concrete,Trees_Fair,No,Poor,Yes_Single_Door,Yes_Single_Door,,2.0,1.0,0.0,1.0,,2.0
5618,Holloway St at Joyland Ave (EB),35.98938,-78.855086,Active,0.0,Poor,,Trees_Fair,No,,,,,1.0,1.0,,,,
5622,Glenbrook Dr at Club Blvd (NB),36.02425,-78.87708,Active,0.0,,,,,,,,,,,,,,
5626,New Castle Rd at FoxFire Apartments (SB),36.049943,-78.92318,Active,0.0,Fair,,,No,,,,,2.0,,,,,
5627,Holloway St at Spruce St,35.994405,-78.880198,Active,0.0,Fair,,,No,Fair,No_SidewalkWithStrip,,,2.0,,1.0,,,
5630,Hinson Dr at Glenbrook Dr (SB),36.02845,-78.87915,Active,0.0,Poor,,Trees_Good,No,,,,,1.0,2.0,,,,
5634,Roxboro Rd at St Paul St,36.01662,-78.89012,Active,0.0,Fair,Concrete,,No,Good,No_SidewalkAbuts,Other,Fair,2.0,,2.0,0.0,1.0,
5639,Main St at Morgan St (EB),36.0009172,-78.91085498,Active,0.0,Poor,,,No,Poor,No_SidewalkWithStrip,,Fair,1.0,,0.0,,1.0,
5645,E Club Blvd at Midland Ter,36.027139,-78.870506,Active,0.0,Fair,Concrete,,No,Fair,No_SidewalkWithStrip,,,2.0,,1.0,,,
5646,Roxboro Rd at Davidson Ave (SB),36.018651,-78.890106,Active,0.0,Fair,Concrete,Trees_Fair,No,Fair,No_SidewalkAbuts,Other,,2.0,1.0,1.0,0.0,,
5647,Angier Ave at Bingham St (WB),35.979427,-78.872118,Active,0.0,Fair,,,No,Fair,No_SidewalkWithStrip,,,2.0,,1.0,,,
5649,Tower Blvd at Durham-Chapel Hill Blvd (McDonalds),35.970438,-78.958133,Active,0.0,Fair,,Trees_Good,No,,,,,2.0,2.0,,,,
5650,Durham-Chapel Hill Blvd at Hope Valley Rd (WB),35.974198,-78.930974,Active,0.0,Fair,,,No,,,,,2.0,,,,,
5653,Fayetteville St at Riddle Rd (NB),35.94853,-78.90356,Active,,,,,,,,,,,,,,,
5654,Horton Rd at Roxboro Rd,36.051043,-78.904403,Active,1.0,Poor,Concrete,Trees_Fair,No,,No_SingleDoor,Yes_Single_Door,Fair,1.0,1.0,,1.0,1.0,
5658,Durham Chapel Hill Blvd at James St,35.974825,-78.926443,Active,0.0,Poor,,Trees_Good,No,,,,,1.0,2.0,,,,
5661,Holloway St at Driver St (EB),35.994382,-78.878173,Active,0.0,Poor,,,No,Fair,No_SidewalkWithStrip,,Fair,1.0,,1.0,,1.0,
5662,Roxboro Rd at Lavender Ave,36.023384,-78.889811,Active,0.0,Fair,,,No,Poor,No_SidewalkWithStrip,,Good,2.0,,0.0,,2.0,
5663,New Hope Commons,35.954424,-78.996621,Active,1.0,Fair,Metal,,Yes,Good,No_SidewalkAbuts,Other,Good,2.0,,2.0,0.0,2.0,
5664,Dearborn Dr at Thelma St (NB),36.037542,-78.873006,Active,0.0,Good,Concrete,,No,,,,,3.0,,,,,
5671,Holloway St at Alston Ave (WB),35.99457,-78.88659,Active,0.0,Fair,Concrete,,No,Good,No_SidewalkWithStrip,,Fair,2.0,,2.0,,1.0,
5672,Fayetteville St at Timothy Ave (SB),35.956916,-78.908791,Active,0.0,Good,,Trees_Fair,No,Fair,No_SidewalkAbuts,Other,Fair,3.0,1.0,1.0,0.0,1.0,
5674,University Dr at Springfield Apts,35.958283,-78.966036,Active,0.0,Fair,,,No,Good,No_SidewalkWithStrip,,,2.0,,2.0,,,
5675,Otis St at Alton St,35.970754,-78.908293,Active,0.0,Poor,,Trees_Good,No,,,,,1.0,2.0,,,,
5677,Broad St at Guess Rd (SB),36.023722,-78.918491,Active,0.0,Fair,Concrete,Trees_Good,No,,,,Poor,2.0,2.0,,,0.0,
5678,Morehead Ave at Cornell St (EB),35.99181,-78.919109,Active,0.0,,,,,,,,,,,,,,
5679,Crutchfield St at Crabtree Ave,36.03892,-78.90312,Active,0.0,Fair,Concrete,Trees_Good,No,,,,Good,2.0,2.0,,,2.0,
5684,W Club Blvd at Clarendon St,36.017035,-78.918244,Active,0.0,Poor,Concrete,,No,Good,No_SidewalkAbuts,Other,Good,1.0,,2.0,0.0,2.0,
5686,Fayetteville Rd at Cook Rd (NB),35.928882,-78.9199,Active,0.0,Poor,,,No,,,,,1.0,,,,,
5689,S Roxboro St at Umstead St (NB),35.982516,-78.903207,Active,1.0,Fair,Concrete,Trees_Fair,No,Good,No_SidewalkAbuts,Other,Good,2.0,1.0,2.0,0.0,2.0,
5690,NC 54 at NC 55 (EB),35.9021852,-78.894779,Active,0.0,Fair,Concrete,Trees_Good,No,Good,No_SidewalkWithStrip,,Poor,2.0,2.0,2.0,,0.0,
5693,Bedford St at Balmoray Ct,35.976893,-78.928676,Active,1.0,Fair,Concrete,,No,,No_SingleDoor,Yes_Single_Door,,2.0,,,1.0,,
5695,Hillandale Rd at Fawn Ave,36.033816,-78.935869,Active,0.0,Good,,,No,Good,No_SidewalkWithStrip,,Fair,3.0,,2.0,,1.0,
5700,Roxboro St at Summit St,35.971234,-78.915069,Active,0.0,Poor,Concrete,,No,Good,No_SidewalkWithStrip,,,1.0,,2.0,,,
5701,Fayetteville St at Massey Ave,35.9801686,-78.8997916,Active,0.0,Fair,Concrete,Trees_Fair,No,Poor,No_SidewalkAbuts,Other,Fair,2.0,1.0,0.0,0.0,1.0,
5702,Roxboro Rd at Knox St (NB),36.01282,-78.890896,Active,0.0,Fair,,Trees_Fair,No,Good,No_SingleDoor,Yes_Single_Door,Good,2.0,1.0,2.0,1.0,2.0,
5703,Guess Rd at Carver St,36.03712,-78.92958,Active,0.0,Fair,Concrete,Trees_Good,No,Good,No_SidewalkAbuts,Other,Poor,2.0,2.0,2.0,0.0,0.0,
5704,Guess Rd at Kirk Rd,36.031936,-78.928768,Active,,,,,,,,,,,,,,,
5706,Roxboro St at Masondale Ave,35.975603,-78.908421,Active,0.0,Poor,Concrete,,No,Poor,No_SidewalkWithStrip,,,1.0,,0.0,,,
5708,Angier Ave at Food Bank CENC (WB),35.9779884,-78.8704559,Active,1.0,Poor,Concrete,,No,,No_SidewalkAbuts,Other,,1.0,,,0.0,,
5709,Roxboro Rd at Markham Ave (SB),36.01043,-78.89173,Active,0.0,Fair,,Trees_Good,No,Good,No_SidewalkWithStrip,,Fair,2.0,2.0,2.0,,1.0,
5711,N Alston Ave at Lee St (NB),36.002009,-78.885772,Active,0.0,,,,No,Fair,,,,,,1.0,,,
5714,Morreene Rd at Sherwood Dr (NB),36.007155,-78.954687,Active,0.0,Poor,,,No,Good,No_SidewalkWithStrip,,Fair,1.0,,2.0,,1.0,
5716,Hillsborough Rd at Hicks St,36.0130582,-78.9318983,Active,0.0,Poor,,,No,Good,No_SidewalkWithStrip,,Good,1.0,,2.0,,2.0,
5717,Hillsborough Rd at Frazee Carpet,36.0162,-78.93737,Active,0.0,Fair,,,No,Good,No_SidewalkAbuts,Other,Poor,2.0,,2.0,0.0,0.0,
5718,LaSalle St at Campus Walk Dr,36.010006,-78.94864,Active,1.0,Fair,Concrete,,No,Good,No_SidewalkAbuts,Other,Fair,2.0,,2.0,0.0,1.0,
5719,Roxboro St at Knox St (SB),36.012825,-78.891059,Active,0.0,Poor,,Trees_Good,No,Poor,Yes_Single_Door,Yes_Single_Door,Good,1.0,2.0,0.0,1.0,2.0,2.0
5721,Chapel Hill Rd at Vineyard St,35.97795,-78.93567,Active,0.0,Poor,,,No,Good,Yes_Single_Door,Yes_Single_Door,Fair,1.0,,2.0,1.0,1.0,2.0
5722,Carver St at Danube Ln (Carver Creek Apts),36.044844,-78.890487,Active,1.0,Poor,Concrete,,No,Good,No_SidewalkWithStrip,,Good,1.0,,2.0,,2.0,
5725,Danube Ln at Ben Franklin Blvd,36.0473105,-78.8883731,Active,,,,,,,,,,,,,,,
5727,Broad St at Sprunt Ave (NB),36.02054,-78.918845,Active,0.0,Fair,,Trees_Fair,No,Fair,No_SidewalkWithStrip,,Good,2.0,1.0,1.0,,2.0,
5728,Fayetteville Rd at Belgreen Rd,35.9360936,-78.9081995,Active,,,,,,,,,,,,,,,
5730,Chapel Hill Rd at Crosswind Ave (Lakewood YMCA),35.984934,-78.929065,Active,0.0,Fair,,,No,Good,No_SidewalkWithStrip,,Good,2.0,,2.0,,2.0,
5732,Hillsborough Rd at Carolina Ave,36.010538,-78.925131,Active,0.0,Fair,,,No,Poor,No_SidewalkWithStrip,,Fair,2.0,,0.0,,1.0,
5733,Lawson St at Wabash St (WB),35.973842,-78.888908,Active,1.0,Poor,Metal,,No,Poor,Yes_Two_Doors,Yes_Two_Doors,Fair,1.0,,0.0,2.0,1.0,3.0
5734,Hillsborough Rd at Rutherford St,36.01047,-78.92755,Active,0.0,Poor,,,No,Fair,No_SidewalkWithStrip,,Good,1.0,,1.0,,2.0,
5735,Holloway St at S Woodcrest St,35.988399,-78.850757,Active,0.0,,,,,,,,,,,,,,
5738,Lawson St at Alston Ave (EB),35.9754445,-78.894505,Active,1.0,Good,Concrete,Trees_Fair,No,Fair,No_SingleDoor,Yes_Single_Door,Poor,3.0,1.0,1.0,1.0,0.0,
5740,Chandler Rd at Chance Dr,35.9949862,-78.8336401,Active,0.0,Fair,,Trees_Fair,No,,,,,2.0,1.0,,,,
5741,E Main St at Roxboro St (WB),35.9940498,-78.8987513,Active,1.0,Good,Metal,Trees_Fair,No,Good,No_SidewalkAbuts,Other,Excellent,3.0,1.0,2.0,0.0,3.0,
5742,Mangum St at Parrish St,35.995829,-78.900135,Active,1.0,Good,,Trees_Good,No,Good,Yes_Two_Doors,Yes_Two_Doors,Excellent,3.0,2.0,2.0,2.0,3.0,3.0
5743,Trent Dr at Duke Clinics ,36.00456,-78.935073,Active,1.0,Fair,Metal,Trees_Good,No,Good,No_SidewalkAbuts,Other,Good,2.0,2.0,2.0,0.0,2.0,
5744,Holloway St at Brye St (EB),35.993267,-78.871888,Active,0.0,Fair,,Trees_Fair,No,Fair,No_SidewalkAbuts,Other,,2.0,1.0,1.0,0.0,,
5746,Roxboro St at Normandy St,35.973566,-78.912206,Active,0.0,Fair,Concrete,Trees_Fair,No,Poor,No_SidewalkWithStrip,,,2.0,1.0,0.0,,,
5749,E Weaver St at Pilot St,35.967722,-78.910178,Active,0.0,Poor,Concrete,Trees_Fair,No,,,,,1.0,1.0,,,,
5754,Chapel Hill Rd at Lakewood Ave (Shopping Center),35.98692,-78.927131,Active,1.0,Fair,Plastic,Trees_Good,No,Fair,No_SingleDoor,Yes_Single_Door,Good,2.0,2.0,1.0,1.0,2.0,
5764,Dearborn Dr at Ader St,36.03759,-78.87404,Active,0.0,Fair,Concrete,Trees_Fair,No,Fair,No_SidewalkWithStrip,,,2.0,1.0,1.0,,,
5765,Hillsborough Rd at Rosehill Ave,36.010649,-78.927815,Active,0.0,Fair,,,No,Good,No_SidewalkWithStrip,,Good,2.0,,2.0,,2.0,
5767,NC 55 at Cherry Dr,35.960475,-78.893463,Active,0.0,Fair,,Trees_Good,No,,,,,2.0,2.0,,,,
5768,NC 55 at Gaston Ave,35.962523,-78.894307,Active,0.0,Fair,,Trees_Good,No,,,,,2.0,2.0,,,,
5769,Lawson St at Wabash St (EB),35.973716,-78.888922,Active,,,,,,,,,,,,,,,
5770,LaSalle St at Hillsborough Rd (Tire King),36.017683,-78.945628,Active,0.0,Fair,Concrete,,No,Fair,No_SidewalkWithStrip,,Fair,2.0,,1.0,,1.0,
5773,Lawson St at Durham Tech Community College (WB),35.974402,-78.880704,Active,2.0,Good,Metal,,No,Good,Yes_Two_Doors,Yes_Two_Doors,Fair,3.0,,2.0,2.0,1.0,3.0
5775,Duke University Rd at Swift Ave (EB),35.997293,-78.924947,Active,0.0,Poor,,Trees_Good,No,Good,No_SidewalkWithStrip,,Good,1.0,2.0,2.0,,2.0,
5778,Hillsborough Rd at Lawndale Ave (WB),36.014786,-78.933818,Active,0.0,Poor,Metal,Other,No,Poor,Yes_Two_Doors,Yes_Two_Doors,Good,1.0,,0.0,2.0,2.0,3.0
5781,W Enterprise St at Fargo St,35.9836822,-78.9064444,Active,0.0,Fair,Concrete,,No,Poor,No_SidewalkAbuts,Other,Good,2.0,,0.0,0.0,2.0,
5787,Roxboro Rd at Wellington Dr (Northern High School),36.061145,-78.903727,Active,,,,,,,,,,,,,,,
5792,Lawson St at Rosewood St,35.975013,-78.891944,Active,0.0,Fair,Concrete,Trees_Fair,No,Poor,No_SidewalkWithStrip,,Poor,2.0,1.0,0.0,,0.0,
5793,Fayetteville Rd at Crooked Creek Pkwy,35.91251,-78.93354,Active,1.0,Fair,Metal,Trees_Fair,No,Good,Yes_Two_Doors,Yes_Two_Doors,Poor,2.0,1.0,2.0,2.0,0.0,3.0
5794,N Alston Ave at Lee St (SB),36.002141,-78.88599,Active,0.0,Poor,Concrete,Trees_Good,No,,,,,1.0,2.0,,,,
5795,Hinson Dr at DeMille St,36.02937,-78.8786,Active,0.0,Poor,Concrete,Trees_Good,No,,,,,1.0,2.0,,,,
5797,Mineral Springs Rd at Sapphire St,35.98772,-78.81872,Active,0.0,Poor,,,No,,,,,1.0,,,,,
5798,Durham-Chapel Hill Blvd at Garrett Rd,35.961312,-78.977905,Active,0.0,Poor,,,No,,,,Poor,1.0,,,,0.0,
5801,Broad St at Markham Ave (SB),36.010453,-78.919662,Active,0.0,Fair,,,No,Fair,No_SidewalkAbuts,Other,Good,2.0,,1.0,0.0,2.0,
5802,Broad St at F St (NB),36.01887,-78.91898,Active,0.0,Poor,,,No,Poor,No_SidewalkWithStrip,,Fair,1.0,,0.0,,1.0,
5803,Milton Rd at Fire Department,36.088965,-78.913505,Active,0.0,Fair,,Trees_Fair,No,Fair,No_SidewalkWithStrip,,,2.0,1.0,1.0,,,
5806,Murray Ave at Broad St,36.028818,-78.912794,Active,0.0,Poor,Concrete,,No,Good,No_SidewalkWithStrip,,Fair,1.0,,2.0,,1.0,
5811,Service Rd at Davidson Ave (SB),36.01797,-78.88757,Active,0.0,Fair,Concrete,,No,,,,,2.0,,,,,
5816,Fayetteville St at Dunstan St,35.978925,-78.900163,Active,0.0,Fair,,,No,Good,No_SidewalkWithStrip,,Fair,2.0,,2.0,,1.0,
5818,Holloway St at Hoover Rd (EB),35.990247,-78.858971,Active,0.0,Poor,Metal,,No,Good,Yes_Two_Doors,Yes_Two_Doors,Poor,1.0,,2.0,2.0,0.0,3.0
5819,E Main St at Dillard St (WB),35.991892,-78.895096,Active,1.0,Good,Metal,,Yes,Good,Yes_Sidewalk,Other,Good,3.0,,2.0,0.0,2.0,3.0
5820,Cornwallis Rd at Century Oaks Dr (SB),35.94093,-78.89815,Active,0.0,Good,,,No,,,,,3.0,,,,,
5821,Holloway St at Briggs Ave,35.993719,-78.873674,Active,0.0,Poor,,Trees_Fair,No,Good,No_SidewalkAbuts,Other,,1.0,1.0,2.0,0.0,,
5822,NC 55 at NC 54 (NB),35.902988,-78.895181,Active,1.0,Fair,Concrete,,No,Fair,Yes_Single_Door,Yes_Single_Door,Poor,2.0,,1.0,1.0,0.0,2.0
5823,University Dr at Academy Rd (WB),35.96737,-78.94497,Active,,,,,,,,,,,,,,,
5824,Lawson St at Concord St (EB),35.976343,-78.903071,Active,1.0,Fair,Concrete,,No,Poor,No_SingleDoor,Yes_Single_Door,Fair,2.0,,0.0,1.0,1.0,
5826,Roxboro Rd at Ellerbee St (SB),36.021653,-78.89006,Active,0.0,Fair,,Trees_Fair,No,Poor,No_SidewalkWithStrip,,,2.0,1.0,0.0,,,
5827,Angier Ave at Hoover Rd (EB),35.9782719,-78.8709516,Active,0.0,Poor,Concrete,,No,Good,No_SidewalkAbuts,Other,,1.0,,2.0,0.0,,
5828,Angier Rd at Hoover Rd (WB),35.9783595,-78.8708022,Active,,,,,,,,,,,,,,,
5829,Fayetteville St at Pilot St (SB),35.963923,-78.90724,Active,1.0,Fair,Concrete,,No,Poor,No_SidewalkWithStrip,,Fair,2.0,,0.0,,1.0,
5832,Dearborn Dr at Apollo St (SB),36.036887,-78.869816,Active,0.0,Fair,,,No,,,,,2.0,,,,,
5833,Dearborn Dr at Usher St (Lakeview School),36.0382592,-78.8777951,Active,,,,,,,,,,,,,,,
5836,Dearborn Dr at Maplewood Dr (south),36.03323,-78.86943,Active,0.0,,Concrete,,No,,,,,,,,,,
